,,,,selected actions to define load quantification parameters and muscle groups to apply loads,,,movement characterization to select action,,,,quantity of stabilization intensity,,,quantity of power intensity,,,,,,,,,,,,,,,
fathom_name,soflete_name,description,,primary_actions,secondary_actions,,training_type,cardio_action,external_weight,,surface_stability,external weight implement,,explosiveness,,youtube_link,equipment,body_position,metrics,tags,sections,strength,endurance,power,number of training types assigned,,id,weight_label,Does not have weight
,10/20/10,"sprint, lunge/cut, sprint, lunge/cut, sprint",,,,,power_drills_plyometrics,,,,stable,,,,,https://youtu.be/Uqk3GPQmiNU,,,Reps; Meters,[],stamina 3; carbine; swim development; soflete rx'd; run repeats; soflete performance; swim repeats; heart rate elevation; pistol - concealed carry; soflete fitness; stamina - swim; pistol - outside the waistband (owb); stamina 1; stamina; stamina 2,0,1,0,1,213,57e2fd3a4c6a031dc777e902,#N/A,
,100 Meter Sprint,,,2,,,strength_cardiorespiratory,run,,,stable,,,speed - low force,,https://www.youtube.com/watch?v=F1WWJGyowqE,,,Time,['basic_functional_movement: sprint'],stamina,0,1,0,1,524,58459de6dc2ce90011f93d86,#N/A,
,100 Up Drill,"alternating high knee, then hold for balance",,,,,strength_endurance,,,,,,,,,https://youtu.be/r1EBrxUCiGs?t=33,,,Reps,[],skill prep; warm-up/movement prep; stamina; endurance,0,1,0,1,1925,5d3f84d4c80618001184ef9e,#N/A,
,2 Inch Board Close Grip Bench Press,,,,,,power_action_olympic_lift,,,,,,,,,https://youtu.be/X2NUmQ_mFIc,barbells,,Reps,['basic_exercise: bench press'],powerlifting 1; strength; strength 1; strength 2,1,0,0,1,1346,5b7d066ea0139b000f7b66e9,Weight (Actual),
,2-Step Broad Jump,"bound, bound, landing of a broad jump",,"2004, 2003b",,,power_action_plyometrics,,,,stable,,,speed - mod force,,https://youtu.be/I1xMNnw91ik,no_equipment,non_stationary_double_leg,Reps,"['basic_exercise: broad jumps', 'basic_functional_movement: step', 'basic_functional_movement: jump']",plyometrics,0,0,1,1,1864,5d079baf60e5d3000f2a888f,#N/A,
,2-Step Lateral Shuffle,"5yards cones, lateral shuffle with change of direction",,,,,power_drills_plyometrics,,,,stable,,,,,https://youtu.be/sd7ZkWe4_lg,,,Reps,"['movement direction - plane: frontal', 'movement direction - axis: lateral', 'basic_functional_movement: step']",stamina 1,0,1,0,1,1718,5c7ed2c6429bf4000f04b97b,#N/A,
Skip to Overhead Medicine Ball Throw,2-Step Overhead Med-Ball Throws,skipping to overhead throw with staggered legs,,2151,"2005, 1103a",,power_action_plyometrics,,,,stable,medicine_balls,,speed - mod force,,https://youtu.be/KTiN0pGTi78,medicine_balls,,Reps; Feet,"['equipment: medicine-slam balls', 'basic_functional_movement: step']",plyometrics,0,0,1,1,1839,5cf5bc00cc3ad8000f2db379,Weight (Actual),
,"2"" Runs",quick feet running in place,,,,,power_drills_plyometrics,,,,stable,,,,,https://youtu.be/pG2wDw89344,,,Seconds,['basic_functional_movement: run'],prehab/dynamic warm-up; warm-up/movement prep; prehab/dynamic warm up,0,0,0,0,677,588a1c5a65dcf3000f912414,#N/A,
,20-40-20,,,,,,power_drills_plyometrics,,,,stable,,,,,https://youtu.be/ZyhoeUc3CRo,,,Reps,[],gun work - pistol: outside the waistband; heart rate elevation; stamina 1; gun work - pistol: concealed carry; gun work - carbine; stamina,0,1,0,1,214,57e2fd3a4c6a031dc777e903,#N/A,
,27 Squat Routine,squats with changing foot position,,,,,strength_integrated_resistance,,,,,,,,,https://youtu.be/wXkh8ofejc0,,,Reps,['basic_functional_movement: squat'],mobility work; assisted work; recovery protocol; neuro adaptation,0,0,0,0,1097,5a465706b0d8ca000f2f5360,#N/A,
,2k Row,,,200,,,strength_cardiorespiratory,row,,,stable,,,speed - low force,,https://youtu.be/VN5H3g-3WLo,rower,,Kilometers; Calories,['equipment: rower'],stamina 3; endurance 1; stamina 1; stamina; endurance,0,1,0,1,522,58459d9ddc2ce90011f93d84,#N/A,
,3 Cone Drill,,,,,,power_drills_plyometrics,,,,stable,,,,,https://youtu.be/rLtvdHEwnus?t=22,,,Reps,[],accessory work; speed work; stamina; plyometrics,0,1,1,2,210,57e2fd3a4c6a031dc777e8fe,Weight (Actual),x
,3 Cone Reaction Drill,,,,,,power_drills_plyometrics,,,,stable,,,,,https://youtu.be/NeY5LCmDQgI,,,Time,[],stamina,0,1,0,1,746,58bacf5fe8f951000fbfe4eb,#N/A,
,3 Hops + Run,,,,,,power_drills_plyometrics,,,,stable,,,,,,,,,"['equipment: running', 'basic_functional_movement: run', 'basic_functional_movement: jump']",,0,0,0,0,1714,5c7d600431c07b000f591edb,#N/A,
,3 Point Dumbbell Row,,,,,,strength_integrated_resistance,,,,,,,,,https://youtu.be/OqeOK6sfmxA,dumbbells,,Reps,"['equipment: dumbbells', 'equipment: rower']",accessory work 1; accessory work; suns out guns out; strength 4; strength 2; strength accessory,1,0,0,1,591,586a8723c04a4e0010871323,Weight (Actual),
,3 Position Clean and Jerk,,,,,,power_action_olympic_lift,,,,,,,,,https://youtu.be/fNFdAxnKZIo,barbells,,Reps,['olympic_lift: clean and jerk'],weightlifting 1; strength 2,1,0,0,1,1384,5b93864bcbb461000f8b9770,Weight (Actual),
,3 Position Clean Deadlift,,,,,,strength_integrated_resistance,,,,,,,,,https://youtu.be/PseviRNTb-w,barbells,,Reps,['olympic_lift: deadlift'],strength 3; strength 1; strength 2; weightlifting 2,1,0,0,1,1072,5a14bcedff5148000f6bc008,Weight (Actual),
,3 Position Power Clean,,,,,,strength_integrated_resistance,,,,,,,,,https://youtu.be/1lcPnq2e_rM,barbells,,Reps,['olympic_lift: power clean'],strength 1,1,0,0,1,1782,5cb6878fcc3ad8000f1f78a7,Weight (Actual),
,3 Position Snatch,,,,,,strength_integrated_resistance,,,,,,,,,https://youtu.be/IrXbuX1XVoc,barbells,,Reps,['olympic_lift: snatch'],strength 1; weightlifting 1; strength 2; strength; warm-up / movement prep; movement primer,1,0,0,1,1025,59ea9ded145143000f71e21b,Weight (1RM),
,3 Position Snatch Deadlift,,,,,,strength_integrated_resistance,,,,,,,,,https://youtu.be/muxecEeHRsg,barbells,,Reps,"['olympic_lift: deadlift', 'olympic_lift: snatch']",strength 3; weightlifting 3; strength 1; strength 2,1,0,0,1,1070,5a14b29321a0de000fcacd46,Weight (Actual),
,3-Way Lunge,,,,,,strength_integrated_resistance,,,,,,,,,https://youtu.be/RvqYZZ7AqIM,dumbbells,,Reps,['basic_functional_movement: lunge'],accessory work 1,0,0,0,0,1889,5d13de4ccc3ad8000f34a2ec,Weight (Actual),
,4 Cone Box Drill,,,"sprint, shuffle, backward run, shuffle",,,power_drills_plyometrics,,,,stable,,,,,https://youtu.be/CYdkZbD8sjw,,,Reps,[],stamina 1; stamina,0,1,0,1,209,57e2fd3a4c6a031dc777e8fd,Weight (Actual),x
,4 Way Dead Bugs,,,,,,strength_endurance,,,,,,,,,https://youtu.be/6XdUv05OPCI,,,Reps,[],strength work,1,0,0,1,240,57e2fd3a4c6a031dc777e923,#N/A,
,400 Meter Sprint,,,1,,,strength_cardiorespiratory,run,,,stable,,,speed - no force,,https://youtu.be/rFlJPm9wd1o,,,Meters,['basic_functional_movement: sprint'],warm-up / movement prep; endurance,0,0,0,0,525,58459df8dc2ce90011f93d87,#N/A,
,5 Cone Zig Zag Drill,,,,,,power_drills_plyometrics,,,,stable,,,,,https://youtu.be/lVM0DU-kdec,,,Reps,[],speed work; plyometrics; stamina 1; stamina 2; stamina; stamina 3,0,1,1,2,212,57e2fd3a4c6a031dc777e900,#N/A,
,5 Minute Flow: The Deep Lunge,,,,,,strength_integrated_resistance,,,,,,,,,https://youtu.be/cyd6tVhmkcw,,,Time,['basic_functional_movement: lunge'],breathing work,0,0,0,0,1110,5a5030f2b0d8ca000f30c99c,#N/A,
Medicine Ball Circuit,5 Way Med Ball Circuit,"in power stance, forward facing overhead throw, forward facing lateral throw on both sides, side facing lateral throw on both sides",,"2101, 2102, 2102","1000, 1000, 1000, 1000, 1000, 1001, 1003 1002, 1002, 1002, 1002",,power_action_plyometrics,,,,stable,medicine_balls,,speed - mod force,,https://youtube.com/watch?v=psuefcS75nA,medicine_balls,,Reps,[],dynamic warm-up,0,0,0,0,581,5861d6b64d0fec0011c02cf9,Weight (Actual),
,5 Way Shoulder Stretch,,,,,,flexibility,,,,,,,,,https://youtu.be/kcze3ieMqww,,,Seconds; Reps; Minutes; Time,[],warm-up/movement prep; movement flow; cool down; mobility; breathing work; mobility work 1; down regulation breathing; recovery protocol; neuro adaptation; mobility work,0,0,0,0,954,59c97d783d98d0000fd7fc8b,#N/A,
,5-10-5 Sprint,"sprint 5m, cut, 5m back, cut, then 10m etc",,,,,power_drills_plyometrics,,,,stable,,,,,https://youtu.be/Uqk3GPQmiNU,,,Reps,['basic_functional_movement: sprint'],carbine; accessory stamina; precision rifle; speed work; plyometrics; heart rate elevation; stamina 1; pistol - outside the waistband; pistol - concealed carry; stamina part 1; conditioning 1; stamina; stamina 2,0,1,1,2,211,57e2fd3a4c6a031dc777e8ff,#N/A,
Medicine Ball Circuit,5-Way Upper Body Med-ball Plyo Circuit,"forward facing overhead throw, forward facing lateral throw on both sides, side facing lateral throw on both sides",,"2101, 2102, 2102",1000,,power_action_plyometrics,,,,stable,medicine_balls,,speed - mod force,,https://youtu.be/KtNufhebd7I,medicine_balls,,,['equipment: medicine-slam balls'],,0,0,0,0,242,57e2fd3a4c6a031dc777e925,#N/A,
,500 Meter Swim,,,300,,,strength_cardiorespiratory,swim,,,stable,,,none,,https://youtu.be/GXiBQuO7R9k,,,Minutes; Meters,['equipment: swimming'],swim cool down; double pst; endurance - swim; stamina- swimming; stamina 2; swimming; endurance; cool down; triathlon - sprint distance; down regulation breathing; stamina- swim; triathlon ssp; cool down/swim; stamina; olympic distance ssp; bud/s pst; triathlon - olympic; triathlon - olympic distance; conditioning; blood flow / transition practice session; swim development; buds pst; olympic distance,0,1,0,1,521,58459d78dc2ce90011f93d83,#N/A,
,6 Inch Hold,"supine on floor, raise feet off ground and hold",,,,,strength_endurance,,,,,,,,,https://youtu.be/v9U6r7Nnryg,,,Seconds; Time,[],accessory work 2; accessory work; warm-up; stamina 1; warm-up / movement prep,0,1,0,1,600,58727a1ab06dc50011d08495,#N/A,
,6 Kick Switch,,,300,,,strength_cardiorespiratory,swim,,,stable,,,none,,https://youtu.be/3mBb2djmdv0,,,Yards,[],cyclic work,0,0,0,0,1106,5a4d3caab0d8ca000f30464b,#N/A,
,6-3-6 Drill,based on freestyle,,300,,,strength_cardiorespiratory,swim,,,stable,,,none,,https://youtu.be/mcgj3rjH2ME,,,,[],,0,0,0,0,1137,5a6836448c6176000f5c20b9,#N/A,
,800 Meter Sprint,,,1,,,strength_cardiorespiratory,run,,,stable,,,speed - no force,,https://youtu.be/KrxJND0FMw4,,,,['basic_functional_movement: sprint'],,0,0,0,0,523,58459dbadc2ce90011f93d85,#N/A,
,90/90 Breathing,90/90 is a position with feet against the wall and 90degree at knee and hip. This supported position then allows breathing training,,,,,skill_development,,,,,,,,,https://youtu.be/yMuuKlmdCmw,,,Reps; Minutes; Seconds,[],warm-up/movement prep; movement flow; cool down; strength work; movement prep; prehab/dynamic warm up; mobility; warm-up/movement prep (run focus 6); breathing work; warm-up; recovery protocol; warm up/movement prep; mobility work; warm-up / movement prep,1,0,0,1,535,5852c572988c130011bbc3c1,#N/A,
,90/90 Breathing w/ Curl Up,,,,,,skill_development,,,,,,,,,https://youtu.be/j3ap_SuMvso,,,Reps; Minutes; Time,[],warm-up/movement prep; accessory work; warm-up / movement primer; movement prep; warm-up /movement prep; mobility; warm-up; warmup/movement prep; neuro adaptation; warm up/movement prep; mobility work; warm-up / movement prep,0,0,0,0,541,58544352988c130011bbc443,#N/A,
,90/90 Breathing w/ Hip Lift,,,,,,movement_prep,,,,,,,,,https://youtu.be/m2OFz37JHug,,,Reps; Minutes,[],warm-up/movement prep; warm-up; warm up/movement prep; mobility work; warm-up / movement prep; warm-up/movement prep (basic apex 2),0,0,0,0,765,58de631178c95c000fc33123,#N/A,
,90/90 Breathing w/ Kettlebell Pull Over,,,,,,movement_prep,,,,,,,,,https://youtu.be/9xcbk7Kk-BM?t=21,kettlebells,,Reps,['equipment: kettlebells'],warm-up/movement prep; warm-up / movement prep,0,0,0,0,1843,5cf8a86bfce11500125489fb,Weight (Actual),
,90/90 Breathing w/ Plate Pullover,,,,,,strength_integrated_resistance,,,,,,,,,https://youtu.be/cU_N6ZsUf4A,plate,,Reps; Time,[],warm-up/movement prep; new blank section #2; movement flow; warm-up / movement work; mobility; warm-up; recovery protocol; warm-up / movement prep; warm up/movement prep; mobility work; warm-up / movement prep; warm-up/movement work; stamina,0,1,0,1,823,59285a41d8d39b000f705657,Weight (Actual),
,90/90 Breathing w/Arm Movement,,,,,,movement_prep,,,,,,,,,https://youtu.be/FKLPoLZPF7Y,,,Reps; Minutes,[],warm-up/movement prep; warm up/movement prep; warm-up; warm-up / movement prep,0,0,0,0,1386,5b94742dcbb461000f8bc166,#N/A,
,90/90 Breathing with Arm Movement,,,,,,movement_prep,,,,,,,,,https://youtu.be/DtXGusTzkZk?t=64,,,Reps,[],warm-up/movement prep; warm up/movement prep,0,0,0,0,1661,5c5fbb146c2e26000f144434,#N/A,
,90/90 Hamstring Activation,,,,,,movement_prep,,,,,,,,,https://youtu.be/DPcFqqXISUg,,,Seconds; Reps; Time,[],warm-up/movement prep; run development day; endurance prep; mobility; sports specific day warm-up; warm-up; bike skill development; run development; sports specific day warm up; sports specific warm-up; warm-up / movement prep; brick session; ssp day warm-up; skill development,0,0,0,0,1088,5a3a88424bfad1000f69d89b,#N/A,
,90/90 Hip IR/ER,,,,,,movement_prep,,,,,,,,,https://youtu.be/2uW-9KD5XOM,,,Reps,[],warm-up/movement prep,0,0,0,0,1644,5c59b320f9f7a8000f780b24,#N/A,
,90/90 Hip Lunge Stretch,,,,,,flexibility,,,,,,,,,https://youtu.be/2uW-9KD5XOM,,,Reps; Seconds,['basic_functional_movement: lunge'],warm-up/movement prep; movement flow; warm-up; recovery protocol; mobility work; warm up/movement prep; mobility work 3; warm-up / movement prep,0,0,0,0,1002,59cda50977c03e000f852219,#N/A,
,90/90 Hip Stretch,,,,,,flexibility,,,,,,,,,https://youtu.be/Or5MINtRCk8,,,Reps; Minutes,[],recovery protocol; skill development; cars warm-up; mobility,0,0,0,0,127,57e2fd3a4c6a031dc777e8a5,#N/A,
,90/90 Hip Switch to Extension,,,,,,movement_prep,,,,,,,,,https://youtu.be/voPIk4EGLmk,,,Reps,['movement direction - plane: sagittal'],warm-up/movement prep; movement prep; mobility work 3; mobility work; warm-up / movement prep; stamina 2,0,1,0,1,1942,5d583c19ebe7d40011ca480a,#N/A,
,90/90 Paused Reverse Lunge,reverse lunge,,,,,strength_integrated_resistance,,,,,,,,,https://youtu.be/8IuvPJpc0vI,dumbbells,,Reps,['basic_functional_movement: lunge'],warm-up/movement prep; accessory work; strength 1; strength 2; warm up/movement prep; warm-up / movement prep,1,0,0,1,1317,5b4e2fedb60e14000fe9a4a8,Weight (Actual),
,90/90 w/ Leg Lift,90/90 position as seated with legs faned at 90 degrees to each side,,,,,strength_integrated_resistance,,,,,,,,,https://www.youtube.com/watch?v=5bYiTJs8Y9c,,,Reps,[],strength 1,1,0,0,1,1729,5c8bdca731c07b000f5d20b5,#N/A,
,A Skip,,,,,,movement_prep,,,,,,,,,https://youtu.be/_MCDR-luwHU,,,Time; Reps; Meters; Feet,[],warm-up/movement prep; skill prep; endurance prep; run warm-up; run development; run warm up; warm-up / movement prep; skill development; stamina; endurance,0,1,0,1,1082,5a39521d4bfad1000f69b951,#N/A,
,Above the Knee Rack Deadlifts,,,,,,strength_integrated_resistance,,,,,,,,,https://youtu.be/e11lVmLsvFU?t=78,barbells,,Reps,['olympic_lift: deadlift'],strength 3; strength; strength 1; strength 2,1,0,0,1,1735,5c9cddd0cc3ad8000f18d94a,Weight (Actual),
Assisted Split Squat Jump,Accelerated Band Split Squat Jumps,"like a jump squat from a lunge position, resistence band used to pull athlete up from floor",,2002,,,power_action_plyometrics,,,,stable,assistance_resistence_bands,,speed - low force,,https://youtu.be/VZBjjdCs6gE,assistance_resistence_bands,,Reps,"['basic_functional_movement: jump', 'basic_functional_movement: squat']",strength 1; strength,1,0,0,1,876,596ac0abc3db3e000f6f9299,#N/A,
,Across Body Arm Swing,,,,,,movement_prep,,,,,,,,,https://youtu.be/rJvvzSR4bEg,,,Reps,[],warm-up/movement prep; prehab/dynamic warm up; prehab/dynamic warm-up; mobility; warm-up; prehab/dynamic warm up (jog 200); warm-up / movement prep,0,0,0,0,481,5826907d473c06100052edfe,#N/A,
,Across Body Curls,bicep curl moving dumbbell to opposite shoulder,,,,,strength_integrated_resistance,,,,,,,,,https://youtu.be/hKMO99aRd7I?t=24,dumbbells,,,[],,0,0,0,0,62,57e2fd3a4c6a031dc777e85e,#N/A,
,Adductor Leg Lifts,"lying on side, lift bottom leg up against gravity. top leg is out of the way stationary",,,,,strength_endurance,,,,,,,,,https://youtu.be/bQ4YHTCGKaM,,,Reps,['movement direction - plane: frontal'],accessory work,0,0,0,0,1776,5cb0a88acc3ad8000f1e045f,#N/A,
,Adductor Push-Up,,,,,,strength_integrated_resistance,,,,,,,,,https://youtu.be/S4CdkwWJDkI,,,Reps,"['basic_exercise: push-ups', 'movement direction - plane: frontal']",warm-up/movement prep; prehab/dynamic warm-up; prehab/dynamic warm up; warm-up; warm-up / movement prep,0,0,0,0,533,58500e8f7126830011fc9a16,#N/A,
,Agility Flow,6-step break dancing move,,,,,movement_prep,,,,,,,,,https://youtu.be/qYBisgt1UwA,,,Reps,[],recovery protocol; recovery work; movement work; mobility,0,0,0,0,1296,5b0f043c1d38c4000feec2b6,#N/A,
,Air Squats,,,,,,strength_integrated_resistance,,,,,,,,,https://youtu.be/73NiUisgdLI,undefined,,Reps; Time,['basic_functional_movement: squat'],callisthenics; strength 1; prehab/dynamic warm up; sunâ€™s out guns out (accessory work); weight vest pyramid; assisted work; stamina- swimming; leg pt pyramid; stamina 3; warm-up/movement prep; body weight movements; cool down; accessory work 2; warm up/movement; soflete rx'd; prehab/dynamic warm-up; soflete performance; stamina- run; weight vest workout; heart rate elevation; stamina 1; soflete fitness; strength; warm up/movement prep; stamina; calisthenics; recovery; accessory work; suns out guns out; strength 3; strongman; soflete rx'd/performance; prehab/dynamic warm up (jog 05:00); running; dynamic warm-up; body weight; conditioning; movement flow; soflete performance/fitness; squat pyramid; warm-up; stamina- running; soflete stamina; warm-up / movement prep; stamina 2,1,1,0,2,1,57e2fd3a4c6a031dc777e81d,Weight (Actual),
,Airdyne,DUPLICATE,,100,,,strength_cardiorespiratory,cycle,,,stable,,,speed - low force,,https://youtu.be/QrM8bNaYHq4,airbike,,Seconds; Meters; Minutes; Miles; Calories; Reps; Time,['equipment: airbike'],skill prep; stamina option 3 - bike; mixed modal 1; triathlon - half ironman distance; mix modal; option 3 - bike; bike base phase; sprint distance; endurance day; bike- 50 mile race; endurance option 2 - bike; half ironman distance; bonus work; stamina option 3; triathlon base phase; cycling / mtb ssp; stamina 3; endurance; cool down; soflete rx'd; conditioning 4; soflete performance; triathlon - sprint distance; weapons development; conditioning 2; soflete fitness; stamina 1; optional endurance day; gymnastics; endurance - bike; stamina prep; bike - 100 mile race; stamina; olympic distance ssp; stamina prep 1; endurance 2 - bike; stamina option 1 - bike; triathlon; strength & stamina; conditioning 3; stamina option 1; olympic distance; bike- 100 mile race; airdyne; triathlon - olympic distance; conditioning; mixed modal 2; warm-up; stamina option 1 - airdyne; bike - 50 mile race; spring ssp; half ironman ssp; stamina 2,1,1,0,2,223,57e2fd3a4c6a031dc777e90c,#N/A,
,Airdyne,DUPLICATE,,100,,,strength_cardiorespiratory,cycle,,,stable,,,speed - low force,,https://youtu.be/GP_FwD94TiU,airbike,,Seconds; Meters; Minutes; Miles; Calories; Reps; Time; Watts,['equipment: airbike'],skill prep; optional am session; strength 1; open 18.1 prep; stamina option 3 - bike; mobility; option 3 - bike; movement work; sprint distance; endurance day; sprint ssp; recovery work; mobility work; stamina option 3; bonus work; triathlon base phase; conditioning prep; stamina 3; warm-up/movement prep; endurance; cool down; soflete rx'd; soflete performance; triathlon - sprint distance; stamina 4; stamina prep 2; conditioning 2; conditioning option b; open 18.3 prep; mixed modal; soflete fitness; stamina 1; optional endurance day; endurance option 2- bike; gymnastics; endurance - bike; strength; stamina prep; warm; stamina; stamina prep 1; accessory work; endurance prep; cyclic work; stamina option 1 - bike; soflete rx'd/performance; open 18.4 prep; open 18.5 prep; cycling/mtb ssp; conditioning 3; stamina option 1; triathlon - olympic distance; conditioning; endurance option 2; cycling; warm-up; conditioning 1; warm-up / movement prep; open 18.2 prep; stamina 2,1,1,0,2,755,58c40ce8c7cfd3000f0d0f92,#N/A,
,Alternate Bounding,,,,,,power_drills_plyometrics,,,,stable,,,,,https://youtu.be/0WF-6oUIFlU,,,Meters,[],plyometrics,0,0,1,1,786,59012701825920000fab5bab,#N/A,
,Alternating DB Crossbody RDL,,,,,,strength_integrated_resistance,,,,,,,,,https://youtu.be/gzAY8R0TLDE,dumbbells,,Reps,"['olympic_lift: romanian deadlift', 'equipment: dumbbells']",warm-up/movement prep; accessory work; accessory work 2; strength 1; warm-up; strength 2; warm-up / movement prep; accessory work 1,1,0,0,1,1229,5ac640bdd4365e000f26e0f8,Weight (2RM),
,Alternating Elbow Plank,,,,,,strength_endurance,,,,,,,,,https://youtu.be/BHpejR4-GhM,,,Seconds; Minutes; Time,['basic_functional_movement: stabilizer'],warm-up/movement prep; accessory work; movement flow; accessory work 2; warm up/movement prep; warm-up / movement prep; mixed modal; core,0,0,0,0,1013,59d3f1a40b81da000ff6afe4,#N/A,
,Alternating KB Push Jerk,,,,,,strength_integrated_resistance,,,,,,,,,https://youtu.be/WsWelJq5apM,kettlebells,,Reps,['equipment: kettlebells'],strength 1; strength 2,1,0,0,1,1215,5ac3b73d16557e000f3d5388,Weight (Actual),
,Alternating Leg Extensions,,,,,,,,,,,,,,,https://youtu.be/-UtH5v2V2ac,,,Seconds,[],accessory work,0,0,0,0,1761,5ca78d6f60e5d3000f14ae1e,#N/A,
Alternating Med-Ball Push-Ups,Alternating Med Ball Plyo Push-Ups,"push-up with one hand on med ball, lateral walk to replace hands, push-up",,"1200, 1201",1004,,power_action_plyometrics,,,,stable,medicine_balls,,speed - no force,,https://youtu.be/gOrIOIoT-q4,medicine_balls,,Reps,['basic_exercise: push-ups'],plyometrics,0,0,1,1,1897,5d22e715fce11500125de393,#N/A,
Russian Twist,Alternating Med Ball Rotations,same as russian twist abs,,"trunk rotation, V-situp",,,strength_endurance,,,,stable,,,,,https://youtu.be/io_KYOwklI8,medicine_balls,,Seconds,[],core,0,0,0,0,1804,5cd32da4fce11500124c0b1b,#N/A,
Alternating Med-Ball Push-Ups,Alternating Med-Ball Push-Ups,"push-up with one hand on med ball, lateral walk to replace hands, push-up",,"1200, 1201",,,power_action_plyometrics,,,,stable,medicine_balls,,speed - no force,,https://youtu.be/oF2dMVdvnik,medicine_balls,,Reps,"['basic_exercise: push-ups', 'equipment: medicine-slam balls']",plyometrics,0,0,1,1,1872,5d07b641fce115001257c8ae,#N/A,
,Alternating Prone Handcuff,"prone, place one hand on back of head and the other on lower back. switch",,,,,strength_integrated_resistance,,,,,,,,,https://youtu.be/VztOFBlS3K8,,prone,Reps,['body position: prone'],accessory work 2,0,0,0,0,1874,5d07b9e4fce115001257ca68,#N/A,
,Alternating Reaching Hands Pillar Holds,,,,,,,,,,,,,,,https://youtu.be/C_T0k4u1WVA,,,,[],,0,0,0,0,225,57e2fd3a4c6a031dc777e90e,#N/A,
,Alternating Sandbag Box Step-Up,,,,,,strength_integrated_resistance,,,,,,,,,https://youtu.be/fqTK9pFI2GQ,sandbags,,Minutes,"['basic_exercise: step-up', 'equipment: sandbags', 'basic_functional_movement: step']",stamina,0,1,0,1,1887,5d12bd4afce11500125a7fed,Weight (Actual),
,Anderson Squat,,,,,,strength_integrated_resistance,,,,,,,,,https://youtu.be/6QDdfRcp5Ko,barbells,,Reps,['basic_functional_movement: squat'],strength 1; strength,1,0,0,1,1380,5b918d3586874b000ffcc910,Weight (5RM),
,Animal Flow,,,,,,,,,,,,,,,https://youtu.be/14BjRxE7f1o,,,Reps,[],recovery protocol; movement work,0,0,0,0,1300,5b0f07393eac7a000f7410d8,#N/A,
,Ankle Circles,,,,,,flexibility,,,,,,,,,https://youtu.be/mzTQGYGI0Ng,,,Reps; Minutes,[],recovery protocol; skill development; recovery protocol 4; cars warm-up,0,0,0,0,1791,5cba364ccc3ad8000f206225,#N/A,
,Ankle Dorsiflexion,,,,,,,,,,,,,,,https://youtu.be/JOoTBdECBHI,,,Reps; Seconds,[],warm-up/movement prep; mobility (ps/te); prehab/dynamic warm up; prehab/dynamic warm-up; mobility; warm-up; prehab/dynamic warm up (jog 200); recovery protocol 1; recovery protocol; mobility work; neuro adaptation; correctives; warm-up / movement prep,0,0,0,0,164,57e2fd3a4c6a031dc777e8cd,#N/A,
,Anterior Hip Mobilization,,,,,,,,,,,,,,,https://youtu.be/B5AtSGtk4wU,,,Minutes,['movement direction - axis: horizontal'],warm-up/movement prep; prehab/dynamic warm-up; prehab/dynamic warm up; mobility; recovery protocol,0,0,0,0,667,5888eb8dba4bcd000fd7a7b5,#N/A,
,Arch Hold,,,,,,,,,,,,,,,https://youtu.be/PCf4T0YtwCI,,,Seconds; Reps; Minutes; Time,[],accessory work; strength 1; strength 3; bonus work- gymnastics; bonus work; stamina,1,1,0,2,1202,5aba667db678c5000fde6ec1,#N/A,
,Arch Rock,,,,,,,,,,,,,,,https://youtu.be/DeeLlZY68eI,,,Reps,[],accessory work 2; accessory work; stamina,0,1,0,1,1876,5d0a6b75cc3ad8000f327867,#N/A,
,Arch to Hollow Holds,,,,,,,,,,,,,,,https://youtu.be/52rFJgO933k,,,Reps; Seconds,[],warm-up/movement prep; accessory work; warm-up; bonus material; warm-up / movement prep,0,0,0,0,670,5889082465dcf3000f9121c3,#N/A,
,Archer Pose,,,,,,,,,,,,,,,https://youtu.be/HMW9ZitIdZ8,,,,[],,0,0,0,0,141,57e2fd3a4c6a031dc777e8b4,#N/A,
,Archer Push-Ups,,,,,,strength_integrated_resistance,,,,,,,,,https://youtu.be/fGaBFKhkI90,,,Reps,['basic_exercise: push-ups'],accessory work; strength 3; bonus material,1,0,0,1,1220,5ac3dd44d4365e000f26768f,#N/A,
,Archer Ring Pull-Ups,,,,,,strength_integrated_resistance,,,,,,,,,https://youtu.be/fethIQ4v3go,,,Reps,['basic_exercise: pull-ups'],strength 2,1,0,0,1,1216,5ac3b8c616557e000f3d53e6,#N/A,
,Archer Ring Row,,,,,,,,,,,,,,,https://youtu.be/4g8CM9pV4X4,,,Reps,['equipment: rower'],bonus material,0,0,0,0,1540,5c0d8a582fa17a000f51c5df,#N/A,
,Arm Circles,,,,,,flexibility,,,,,,,,,https://youtu.be/bP52FXTlzjA,,,Reps; Minutes,[],recovery protocol; warm-up/movement prep; stamina; recovery protocol 4,0,1,0,1,1184,5aaf677c16557e000f3af354,#N/A,
