,Diaphragmatic Breathing Technique,,,,,,,,,,,,,,,https://www.youtube.com/watch?v=0Ua9bOsZTYg,,,Reps; Minutes; Time,[],new blank section #4; movement flow; cool down; down regulation breathing work; mobility; breathing work; warm-up; movement work; down regulation breathing; recovery protocol; movemental flow; breathing / mobility work / movement,0,0,0,0,1068,5a0edb64ff5148000f6b1fdf,#N/A,
,Dip Shrug,,,,,,,,,,,,,,,https://youtube.com/watch?v=h0J7YwDMLYs,,,Reps,['basic_exercise: dips'],warm-up/movement prep; suns out guns out; warm-up / movement prep (raiden 4); prehab/dynamic warm-up; prehab/dynamic warm up; recovery protocol; dynamic warm-up; correctives; warm-up / movement prep,0,0,0,0,161,57e2fd3a4c6a031dc777e8ca,#N/A,
,Dips on Bar,,,,,,,,,,,,,,,,,,Reps; Time,['basic_exercise: dips'],callisthenics; accessory work; suns out guns out; strength 1; strength 3; warm-up; strength 2; strength; accessory work 1; stamina; calisthenics; stamina 2,1,1,0,2,93,57e2fd3a4c6a031dc777e881,Weight (Actual),
,Dips with Chains,,,,,,,,,,,,,,,,,,,['basic_exercise: dips'],,0,0,0,0,285,57e2fd3a4c6a031dc777e952,#N/A,
,Dirty Dog,,,,,,,,,,,,,,,https://youtu.be/QxYSX3XEmQE,,,Reps,[],cool down; stretch; mobility; stamina/strength 3; warm-up; stamina/strength 1; warm-up/mobility 2; cool down/stretch; stamina 1; warm-up/mobility; stamina 2; stretch/recovery; stamina; core; stamina 3,1,1,0,2,146,57e2fd3a4c6a031dc777e8ba,#N/A,
,Dive Bomber Push-Up,,,,,,strength_integrated_resistance,,,,,,,,,https://youtu.be/U87gigSOgqs,,,Reps; Time,['basic_exercise: push-ups'],mobility work; warm-up; movemental flow,0,0,0,0,1238,5ace9ac0b678c5000fe13dc6,#N/A,
,Donkey Kick Backs,,,,,,,,,,,,,,,https://youtu.be/Im5nE3J558k,,,Reps,[],warm-up; assistance work; strength 2,1,0,0,1,1157,5a8caa917f2621000ff917af,#N/A,
,Door Stretch,,,,,,flexibility,,,,,,,,,https://www.youtube.com/watch?v=xzR9trLRD0c,,,Seconds; Minutes; Time,[],warm-up/movement prep; warm-up / movement prep; warm-up; recovery protocol,0,0,0,0,128,57e2fd3a4c6a031dc777e8a6,#N/A,
,Dot Drills,dot mat. Speed drill as moving feet,,,,,power_drills_plyometrics,,,,stable,,,speed - no force,,,,,,[],,0,0,0,0,220,57e2fd3a4c6a031dc777e909,#N/A,
,Double Arm Dumbbell Push Press,,,,,,power_action_olympic_lift,,,,,,,,,https://youtu.be/l2ovJjQvT_0?list=PL4T3VJwPWwuEnPSfKLKNVPGX02-ybszb3,dumbbells,,Reps; Minutes; Time; Seconds,"['olympic_lift: push press', 'equipment: dumbbells']",stamina 3; strength 1; soflete rx'd; soflete performance; soflete rx'd/performance; strength 3; mixed modal; soflete fitness; stamina 1; gymnastics; conditioning 1; strength; stamina; stamina 2,1,1,0,2,555,585c3a604d0fec0011c02769,Weight (Actual),
,Double Arm Landmine Press,,,,,,strength_integrated_resistance,,,,,,,,,https://www.youtube.com/watch?v=962b-0Dce0Y,,,Reps,[],strength 2; strength 1; strength 3,1,0,0,1,903,597cdf05c3db3e000f719b31,Weight (Actual),
,Double DB Overhead Hold,,,,,,strength_integrated_resistance,,,,,,,,,https://www.youtube.com/watch?v=n6FmHK6itcE,dumbbells,,Seconds; Minutes,['equipment: dumbbells'],warm-up/movement prep; stamina 1; stamina; strength 3,1,1,0,2,1688,5c6a28427358c8000f7b2c7d,Weight (Actual),
,Double Dumbbell Clean,,,,,,strength_integrated_resistance,,,,,,,,,https://youtu.be/RF8iX5jl2Ng?list=PL4T3VJwPWwuEnPSfKLKNVPGX02-ybszb3,dumbbells,,Reps,['equipment: dumbbells'],conditioning; soflete rx'd; soflete performance; soflete fitness; stamina,0,1,0,1,553,585c395d4d0fec0011c02767,Weight (Actual),
,Double Dumbbell Front Squat,,,,,,strength_integrated_resistance,,,,,,,,,https://youtu.be/k-qoKq9pQns?list=PL4T3VJwPWwuEnPSfKLKNVPGX02-ybszb3,dumbbells,,Reps,"['equipment: dumbbells', 'basic_functional_movement: squat']",stamina 3; conditioning option a; strength 1; stamina; stamina 1; conditioning 1; strength; open 18.2 prep; movement primer; stamina 2,1,1,0,2,568,585d69a44d0fec0011c028f7,Weight (Actual),
,Double Dumbbell Lunge,,,,,,strength_integrated_resistance,,,,,,,,,https://youtu.be/jpBYnTEoCSk?list=PL4T3VJwPWwuEnPSfKLKNVPGX02-ybszb3,dumbbells,,Reps; Meters; Feet; Seconds,"['equipment: dumbbells', 'basic_functional_movement: lunge']",accessory work; strength 2; stamina 1; skys out thighs out 2; strength; stamina; stamina 2,1,1,0,2,49,57e2fd3a4c6a031dc777e84f,Weight (Actual),
,Double Dumbbell Sit-Ups,,,,,,strength_endurance,,,,,,,,,https://youtu.be/B7hgfU4Fs8w?t=9,dumbbells,,Reps; Seconds,['equipment: dumbbells'],stamina,0,1,0,1,1763,5cabc19460e5d3000f15a91c,Weight (Actual),
,Double Dumbbell Strict Press,,,,,,strength_integrated_resistance,,,,,,,,,https://youtu.be/9c8wGfhUZAM?list=PL4T3VJwPWwuEnPSfKLKNVPGX02-ybszb3,dumbbells,,Reps; Minutes; Time; Seconds,['equipment: dumbbells'],strength work; accessory work; accessory work 2; suns out guns out; strength 1; sunâ€™s out guns out (accessory work); soflete rx'd; soflete performance; warm-up; strength 2; lightweight shoulders; soflete fitness; strength; stamina; stamina 2,1,1,0,2,557,585c3dba4d0fec0011c0276b,Weight (Actual),
,Double Dumbbell Swings,,,,,,,,,,,,,,,,dumbbells,,,['equipment: dumbbells'],,0,0,0,0,198,57e2fd3a4c6a031dc777e8f2,#N/A,
,Double Foot Elevated Split Squat,,,,,,strength_integrated_resistance,,,,,,,,,https://www.youtube.com/watch?v=eibWC4QsNnw,,,Reps,['basic_functional_movement: squat'],warm-up/movement prep; accessory work; strength 1; strength 2; strength; warm-up / movement prep,1,0,0,1,969,59ca8e603d98d0000fd81605,Weight (Actual),
,Double KB Clean,,,,,,strength_integrated_resistance,,,,,,,,,https://www.youtube.com/watch?v=3sgCapAQUd0,kettlebells,,Reps; Time,['equipment: kettlebells'],strength 3; stamina 1; strength; stamina; strongman,1,1,0,2,1090,5a3b0bc78347fc000f1d34f1,Weight (Actual),
,Double KB Clean & Jerk,,,,,,strength_integrated_resistance,,,,,,,,,https://www.youtube.com/watch?v=OKxsA2fZbfE,kettlebells,,Reps,['equipment: kettlebells'],strength 1; mix modal; strength 2; stamina 1; stamina; stamina 2,1,1,0,2,906,59820f51332cef000f6a5e3c,Weight (Actual),
,Double KB Deadlift,,,,,,strength_integrated_resistance,,,,,,,,,https://www.youtube.com/watch?v=UnHF1g7PHE8,kettlebells,,Reps,"['olympic_lift: deadlift', 'equipment: kettlebells']",accessory work; soflete rx'd; strength 1; soflete performance; strength 2; soflete fitness; stamina 1; strength; stamina,1,1,0,2,908,59846ebec3db3e000f725fbf,Weight (Actual),
,Double KB Hang Clean,,,,,,strength_integrated_resistance,,,,,,,,,https://youtu.be/YN6WsqGXFKU,kettlebells,,Reps,"['olympic_lift: hang clean', 'equipment: kettlebells']",stamina,0,1,0,1,1335,5b64f2adab05cc000ffa2e41,Weight (Actual),
,Double KB Sit-Up,,,,,,strength_endurance,,,,,,,,,https://www.youtube.com/watch?v=LZXJAYOFKiM,kettlebells,,Reps; Minutes; Seconds,['equipment: kettlebells'],accessory work; strength 1; strength 2,1,0,0,1,1236,5ac90162d4365e000f27481a,Weight (Actual),
,Double KB Snatch,,,,,,strength_integrated_resistance,,,,,,,,,https://www.youtube.com/watch?v=tXBqqW-qswQ,kettlebells,,Reps,"['olympic_lift: snatch', 'equipment: kettlebells']",strength 1; strength 2; stamina 1; strength; warm up/movement prep; stamina; stamina 2,1,1,0,2,919,598b0c06332cef000f6b5f11,Weight (Actual),
,Double KB Speed Row,,,,,,,,,,,,,,,https://www.youtube.com/watch?v=Qh9eIX8ImXk,kettlebells,,Reps,"['equipment: kettlebells', 'equipment: rower']",accessory work,0,0,0,0,1093,5a3bd7c48347fc000f1d4277,Weight (Actual),
,Double KB Turkish Get-Up,,,,,,,,,,,,,,,https://www.youtube.com/watch?v=q4JSQU9lyfs,kettlebells,,,['equipment: kettlebells'],,0,0,0,0,1269,5ae75ff51d38c4000fe9a17f,#N/A,
,Double KB Windmill,,,,,,,,,,,,,,,https://www.youtube.com/watch?v=PK189hAphbU,kettlebells,,Reps,['equipment: kettlebells'],accessory work; suns out guns out; strength 2; trunk work; strength 7; strength; bonus work (optional),1,0,0,1,788,59013116d3a431000f793954,Weight (Actual),
,Double KB Z Press,,,,,,strength_integrated_resistance,,,,,,,,,https://www.youtube.com/watch?v=5EAOBu-EQKk,kettlebells,,Reps,['equipment: kettlebells'],accessory work; soflete rx'd; strength 1; soflete performance; weapons development; strength 2; soflete fitness; neuro adaptation; mobility work; accessory work 1,1,0,0,1,915,5989c274332cef000f6b3232,Weight (Actual),
,Double Kettlebell Clean and Jerk,,,,,,power_action_olympic_lift,,,,,,,,,https://www.youtube.com/watch?v=2Ce54mMYYp0,kettlebells,,Reps,"['olympic_lift: clean and jerk', 'equipment: kettlebells']",stamina; strength 3,1,1,0,2,1680,5c6764de7358c8000f7aada3,Weight (Actual),
,Double Kettlebell Front Rack Box Step Up,,,,,,strength_integrated_resistance,,,,,,,,,https://www.youtube.com/watch?v=NKCVGaeg-KM,kettlebells,,Reps; Time; Seconds,"['basic_exercise: step-up', 'equipment: kettlebells', 'basic_functional_movement: step']",warm-up/movement prep; accessory work; accessory work 2; strength 1; strength 3; mobility; warm-up; warm-up / movement prep; accessory work 1; stamina,1,1,0,2,1272,5af1cac91d38c4000feaf408,Weight (Actual),
,Double Kettlebell Front Rack Carry,,,,,,strength_integrated_resistance,,,,,,,,,https://www.youtube.com/watch?v=cu815BHSVqU,kettlebells,,Seconds; Meters; Feet; Reps; Time,"['basic_exercise: carry', 'equipment: kettlebells']",strength 1; mix modal; stamina 3; warm-up/movement prep; soflete rx'd; soflete performance; strongwoman; trunk work; soflete fitness; stamina 1; strength; stamina; accessory work; strength 3; trunk work 2; strength & stamina; strongwoman work; strength 4; warm-up; warm-up / movement prep; accessory work 1; stamina 2,1,1,0,2,804,590c9b31ba76ab000ff1f85d,Weight (Actual),
,Double Kettlebell Front Rack Walking Lunge,,,,,,strength_integrated_resistance,,,,,,,,,https://youtu.be/X_vdyRPBMwg,kettlebells,,Reps; Meters; Feet; Seconds,"['equipment: kettlebells', 'basic_functional_movement: lunge']",warm-up/movement prep; strength 1; strength 3; strength 2; stamina 1; stamina; strongman,1,1,0,2,1415,5bb46fde1f5e07000ff6db50,Weight (Actual),
,Double Kettlebell Front Rack Wall Sit,,,,,,strength_integrated_resistance,,,,,,,,,https://youtu.be/9yBnMm0RDW0,kettlebells,,Seconds; Reps; Minutes,['equipment: kettlebells'],accessory work; accessory work 1; stamina,0,1,0,1,1829,5ce73743fce115001250b6f6,Weight (Actual),
,Double Kettlebell Front Squat,,,,,,strength_integrated_resistance,,,,,,,,,https://youtu.be/jpBYnTEoCSk?list=PL4T3VJwPWwuEnPSfKLKNVPGX02-ybszb3,kettlebells,,Reps; Time; Seconds,"['equipment: kettlebells', 'basic_functional_movement: squat']",accessory work; strength 1; strength 3; warm-up; strength 2; stamina 1; strength; mobility work; warm-up / movement prep; stamina; movement primer,1,1,0,2,567,585d693c4d0fec0011c028f6,Weight (Actual),
,Double Kettlebell Hang Clean and Jerk,,,,,,power_action_olympic_lift,,,,,,,,,https://youtu.be/noQxrawvr78,kettlebells,,Reps,"['olympic_lift: hang clean', 'olympic_lift: clean and jerk', 'equipment: kettlebells']",soflete performance/fitness; stamina; soflete rx'd,0,1,0,1,1914,5d36b604fce115001262f393,Weight (Actual),
,Double Kettlebell Lunge,,,,,,strength_integrated_resistance,,,,,,,,,,kettlebells,,Reps,"['equipment: kettlebells', 'basic_functional_movement: lunge']",warm-up; strength 1; strength; stamina 3,1,1,0,2,48,57e2fd3a4c6a031dc777e84e,Weight (Actual),
,Double Kettlebell Push Press,,,,,,power_action_olympic_lift,,,,,,,,,https://youtu.be/5L7i0u3pvY0,kettlebells,,Reps,"['olympic_lift: push press', 'equipment: kettlebells']",strength 1; strongman; warm-up; mix modal; stamina 1; strength; warm-up / movement prep; stamina; stamina 2,1,1,0,2,636,5881085d9f4d4d000f6e07a0,Weight (5RM),
,Double Kettlebell Swings,,,,,,power_action_plyometrics,,,,,kettlebells,,,,https://www.youtube.com/watch?v=ZOLoHiNIgC8,kettlebells,,Reps; Time; Seconds,['equipment: kettlebells'],conditioning; accessory work; soflete rx'd; strength 1; soflete performance; strength 2; soflete fitness; stamina 1; strength; stamina 2; stamina; stamina 3,1,1,0,2,197,57e2fd3a4c6a031dc777e8f1,Weight (Actual),
,Double Kettlebell Thrusters,,,,,,power_action_plyometrics,,,,,kettlebells,,,,https://www.youtube.com/watch?v=gpB9AsEZLM4,kettlebells,,Reps; Time,['equipment: kettlebells'],conditioning; accessory work; strength 1; stamina 1; strength; warm up/movement prep; stamina; stamina 3,1,1,0,2,34,57e2fd3a4c6a031dc777e83f,Weight (Actual),
,Double Kettlebell/Dumbbell Squats,,,,,,strength_integrated_resistance,,,,,,,,,,kettlebells,,Reps,"['equipment: dumbbells', 'equipment: kettlebells', 'basic_functional_movement: squat']",accessory work,0,0,0,0,461,57e2fd3b4c6a031dc777ea08,Weight (Actual),
,Double Leg Zig Zag Bound Start,,,,,,,,,,,,,,,,,,,['body position: double leg standing'],,0,0,0,0,287,57e2fd3a4c6a031dc777e954,#N/A,
,Double Leg Zig Zag Bounding,,,,,,,,,,,,,,,,,,,['body position: double leg standing'],,0,0,0,0,288,57e2fd3a4c6a031dc777e955,#N/A,
,Double Overhead Kettlebell Carry,,,,,,strength_integrated_resistance,,,,,,,,,https://youtu.be/qbygGHTRhR4?list=PL4T3VJwPWwuFotqGyAGlfoYdkoTQzbrZe,kettlebells,,Seconds; Meters; Feet; Reps; Time,"['basic_exercise: carry', 'equipment: kettlebells']",warm-up/movement prep; accessory work; stamina 3; strength 1; strength 3; warm-up; mix modal; strength 4; strength 2; stamina 1; assisted work; strength; warm-up / movement prep; stamina; strongman,1,1,0,2,635,5881083e9f4d4d000f6e0799,Weight (Actual),
,Double Unders,,,,,,,,,,,,,,,https://www.youtube.com/watch?v=2TfjmxeUsIs,,,Reps; Minutes; Time; Seconds,[],optional am session; weapons development 2; bonus work; stamina 3; warm-up/movement prep; soflete rx'd; conditioning option a; soflete performance; open 18.3 prep; weapons development; conditioning 2; conditioning option b; soflete fitness; stamina 1; gymnastics; stamina; soflete rx'd/performance; conditioning 3; stamina option 1; weapons development 1; bonus work- barbell cycling; conditioning; warm-up; strength 2; conditioning 1; stamina 2,1,1,0,2,662,588789c065dcf3000f9116bb,Weight (Actual),
,Downward Dog Modifications,,,,,,,,,,,,,,,https://youtu.be/HNPqKErn2gQ?list=PL4T3VJwPWwuFotqGyAGlfoYdkoTQzbrZe,,,,[],,0,0,0,0,642,58816fb2f8fcd2000f909428,#N/A,
,Downward Facing Dog Shoulder Stretch,,,,,,flexibility,,,,,,,,,https://youtu.be/H8tzrLD8mMo,,,Seconds; Reps; Minutes; Time,[],mobility; breathing work; recovery portocol; movement work; recovery protocol; recovery work; neuro adaptation; recovery day; mobility work; recovery protocol (long); cool down; down regulation breathing; breathing / movement work; breathing / mobility work / movement; recovery; stretch; breathing / mobility work; new blank section #6; mobility (forward fold); movement flow; mobility (long); warm-up; movement/breathing work; movement / breathing work,0,0,0,0,138,57e2fd3a4c6a031dc777e8b1,#N/A,
,Dragon Flags,,,,,,,,,,,,,,,https://www.youtube.com/watch?v=OztfKYNOplw,,,Reps,[],recovery; accessory work; strength 6; assistance work; stamina,1,1,0,2,933,59aa023afd7558000f844946,#N/A,
,Dragon Fly Sit-Ups,,,,,,strength_endurance,,,,,,,,,https://youtu.be/sCCNn7D3Jg4,,,Reps,[],accessory work,0,0,0,0,1635,5c5102f634c0c7000f09c12a,#N/A,
,Dragon Pose (kneeling hip flexor stretch),,,,,,flexibility,,,,,,,,,https://www.youtube.com/watch?v=2-MRBXE-oPE,,,Reps; Minutes; Time; Seconds,['body position: kneeling'],mobility; breathing work; breathing / movement work; recovery protocol; movement / breathing work; pigeon pose; down regulation breathing work,0,0,0,0,142,57e2fd3a4c6a031dc777e8b5,#N/A,
,Drinking Bird,,,,,,,,,,,,,,,https://youtube.com/watch?v=bOl8vXR10cc,,,Reps; Meters,[],warm-up/movement prep; prehab/dynamic warm up; prehab/dynamic warm-up,0,0,0,0,166,57e2fd3a4c6a031dc777e8cf,#N/A,
,Drop Lunge to Leg Lift,,,,,,strength_integrated_resistance,,,,,,,,,https://youtu.be/CmwXTx8maOE,,,Reps,['basic_functional_movement: lunge'],accessory work; strength 1,1,0,0,1,1318,5b4fc3b261071e000f07c069,#N/A,
,Drop Snatch,,,,,,strength_integrated_resistance,,,,,,,,,https://youtu.be/EQrcCmgraa8,,,Reps,['olympic_lift: snatch'],movement primer,0,0,0,0,1108,5a4ff865ab889d000f546257,Weight (Actual),
,Drop Step Rotational Med Ball Scoop Toss,,,,,,power_action_plyometrics,,,,,medicine_balls,,,,https://www.youtube.com/watch?time_continue=8&v=uFjmrhXsFMI,medicine_balls,,Reps,"['movement direction - plane: transverse', 'movement direction - axis: rotational', 'basic_functional_movement: step']",strength; plyometrics,1,0,1,2,1065,5a0dbdb8ff5148000f6b065e,Weight (Actual),
,Dual Dumbbell Tricep Kick Back,,,,,,,,,,,,,,,https://youtu.be/ezGC3jcefXM,dumbbells,,Reps,['equipment: dumbbells'],accessory work,0,0,0,0,1755,5ca2643e60e5d3000f132975,Weight (Actual),
,Dual Kettlebell Push Jerk,,,,,,strength_integrated_resistance,,,,,,,,,https://youtu.be/B7oYTEmJ22M,kettlebells,,,['equipment: kettlebells'],,0,0,0,0,1946,5d5dcc0febe7d40011cc3c59,#N/A,
,Duck Walks,,,,,,,,,,,,,,,https://youtu.be/TgUfmjDjnfw?list=PL4T3VJwPWwuFotqGyAGlfoYdkoTQzbrZe,,,Seconds; Yards; Meters; Feet,['basic_functional_movement: step'],warm-up/movement prep; movement flow; cool down; recovery; accessory work; prehab/dynamic warm up; mobility; breathing work; warm-up; movement work; down regulation breathing; recovery protocol; movement flow/breathing protocol; loco motion; neuro adaptation; mobility work; warm-up / movement prep; stamina,0,1,0,1,174,57e2fd3a4c6a031dc777e8d7,#N/A,
,Dumbbell Bear Crawl,,,,,,strength_integrated_resistance,,,,,,,,,https://youtu.be/3lx3uyZHHlU,dumbbells,,Reps; Meters; Feet,['equipment: dumbbells'],stamina 3; accessory work; mix modal; strength 2; stamina 1; strength; stamina; stamina 2,1,1,0,2,630,5880fe499f4d4d000f6e0667,Weight (Actual),
,Dumbbell Bear Crawl Drag,,,,,,strength_integrated_resistance,,,,,,,,,https://youtu.be/v7DEaJFhnmU,dumbbells,,Reps; Meters; Feet,['equipment: dumbbells'],stamina; trunk work 2; trunk work,0,1,0,1,1883,5d11632460e5d3000f2cd81e,Weight (Actual),
,Dumbbell Bench Press,,,,,,strength_integrated_resistance,,,,,,,,,https://youtu.be/G9nf-QZeYWI,dumbbells,,Reps; Seconds,"['basic_exercise: bench press', 'equipment: dumbbells']",accessory work; suns out guns out; strength 1; strength 3; strength 4; strength 2; assistance work; stamina 1; strength; stamina,1,1,0,2,41,57e2fd3a4c6a031dc777e847,Weight (Actual),
,Dumbbell Bench with Elbows Out,,,,,,,,,,,,,,,,dumbbells,,,['equipment: dumbbells'],,0,0,0,0,289,57e2fd3a4c6a031dc777e956,#N/A,
,Dumbbell Bicep Curls,,,,,,,,,,,,,,,https://youtube.com/watch?v=ZawrdYA0WXU,dumbbells,,Reps,['equipment: dumbbells'],accessory work 2; accessory work; suns out guns out; strength 3; strength 4; assisted work; strength; curls for the girls; accessory work 1; suns out guns out 2,1,0,0,1,503,583f0adffbefd210001e35b0,Weight (Actual),
,Dumbbell Box Jumps,,,,,,power_action_plyometrics,,,,,dumbbells,,,,https://youtu.be/8xPAWqwb2vk,dumbbells,,,"['basic_exercise: box jumps', 'equipment: dumbbells', 'basic_functional_movement: jump']",,0,0,0,0,290,57e2fd3a4c6a031dc777e957,#N/A,
,Dumbbell Box Step-Ups,,,,,,strength_integrated_resistance,,,,,,,,,https://youtu.be/8apVstrFT4Y,dumbbells,,Reps; Seconds,"['basic_exercise: step-up', 'equipment: dumbbells', 'basic_functional_movement: step']",stamina 3; accessory work; powerlifting; strength 1; strength 3; mix modal; accessory work 3; strength 4; mixed modal; strength 2; skyâ€™s out thighs out (accessory work); skys out thighs out; stamina 1; strength; stamina 2; accessory work 1; stamina; strongman,1,1,0,2,1337,5b6d3dd7a0139b000f780412,Weight (Actual),
,Dumbbell Burpee Box Jumps,,,,,,power_action_plyometrics,,,,,dumbbells,,,,,dumbbells,,,"['basic_exercise: box jumps', 'equipment: dumbbells', 'basic_functional_movement: jump']",,0,0,0,0,291,57e2fd3a4c6a031dc777e958,#N/A,
,Dumbbell Burpee Over the Box,,,,,,power_action_plyometrics,,,,,dumbbells,,,,https://www.youtube.com/watch?v=Nz_B57qj1bU,dumbbells,,Reps,['equipment: dumbbells'],stamina; strength 2,1,1,0,2,1237,5acc0542d4365e000f27ac2a,Weight (Actual),
,Dumbbell Calf Raise,,,,,,,,,,,,,,,https://youtu.be/wwy3BSUjlW4,dumbbells,,Reps; Feet,['equipment: dumbbells'],accessory work 2; skys out thighs out; accessory work 3; skyâ€™s out thighs out (accessory work),0,0,0,0,263,57e2fd3a4c6a031dc777e93c,Weight (Actual),
,Dumbbell Clean and Jerk,,,,,,power_action_olympic_lift,,,,,,,,,https://youtu.be/Z3zgdpt_LdI,dumbbells,,Reps,"['olympic_lift: clean and jerk', 'equipment: dumbbells']",soflete rx'd; strength 1; soflete performance; warm-up; soflete fitness; mix model; conditioning 1; stamina; stamina 3,1,1,0,2,590,5869bd6ac04a4e001087127b,Weight (Actual),
,Dumbbell Cossack Squat,,,,,,strength_integrated_resistance,,,,,,,,,https://youtu.be/Yz9FMsoJgQc,dumbbells,,Reps,"['equipment: dumbbells', 'basic_functional_movement: squat']",accessory work; stamina,0,1,0,1,1928,5d4377e23839d90015641758,Weight (Actual),
,Dumbbell Cross Body Romanian Deadlift,,,,,,strength_integrated_resistance,,,,,,,,,https://youtu.be/kZR68f5AYLM,dumbbells,,Reps,"['olympic_lift: deadlift', 'olympic_lift: romanian deadlift', 'equipment: dumbbells']",accessory work 2; accesssory work; strength 3,1,0,0,1,1772,5cb09dbecc3ad8000f1e00ed,Weight (Actual),
,Dumbbell Deadlift,,,,,,strength_integrated_resistance,,,,,,,,,https://youtu.be/gLogcYIvgRA?t=11,dumbbells,,Reps,"['olympic_lift: deadlift', 'equipment: dumbbells']",warm-up/movement prep; skys out thighs out; stamina 1; strength; stamina,1,1,0,2,1676,5c64829e6c2e26000f159ebf,Weight (Actual),
,Dumbbell Floor Press,,,,,,strength_integrated_resistance,,,,,,,,,https://youtu.be/fc7sLXRrQaU,dumbbells,,Reps,['equipment: dumbbells'],warm-up/movement prep; accessory work; strength 1; strength,1,0,0,1,1878,5d106eb4cc3ad8000f33a70d,Weight (Actual),
,Dumbbell Flys,,,,,,,,,,,,,,,https://www.youtube.com/watch?v=y_Z2LftZDvk,dumbbells,,Reps,['equipment: dumbbells'],accessory work; suns out guns out; strength 1; sunâ€™s out guns out (accessory work); accessory work 3; strength 4; strength; accessory work 1,1,0,0,1,675,588a1a3d65dcf3000f9123ba,Weight (Actual),
,Dumbbell Front Rack Carry,,,,,,strength_integrated_resistance,walk,,,,,,,,https://youtu.be/liiLiyUMwCQ,dumbbells,,Meters; Feet,"['basic_exercise: carry', 'equipment: dumbbells']",stamina 1; stamina,0,1,0,1,1892,5d1bc8a660e5d3000f2f4955,Weight (Actual),
,Dumbbell Hamstring Curl,,,,,,,,,,,,,,,https://youtu.be/leFSrMGBh0c?t=3,dumbbells,,Reps,['equipment: dumbbells'],accessory work; accessory work 1; strength 2,1,0,0,1,1603,5c2554a69eb3da000f131f04,Weight (Actual),
,Dumbbell Hang Power Clean,,,,,,strength_integrated_resistance,,,,,,,,,https://www.youtube.com/watch?v=mtQcT3ZO4wY,dumbbells,,Reps; Seconds,"['olympic_lift: power clean', 'equipment: dumbbells']",conditioning; soflete rx'd; strength 1; soflete performance; strength 2; soflete fitness; stamina 1; ghd; strength; stamina; stamina 3,1,1,0,2,278,57e2fd3a4c6a031dc777e94b,Weight (Actual),
,Dumbbell Hang Snatch,,,,,,strength_integrated_resistance,,,,,,,,,https://youtu.be/N08MH8tmiKM?list=PL4T3VJwPWwuEnPSfKLKNVPGX02-ybszb3,dumbbells,,Reps,"['olympic_lift: snatch', 'equipment: dumbbells']",stamina 1; stamina,0,1,0,1,556,585c3d5f4d0fec0011c0276a,Weight (Actual),
,Dumbbell Hang Squat Clean,,,,,,strength_integrated_resistance,,,,,,,,,https://www.youtube.com/watch?v=8GtpyylnC0E,dumbbells,,Reps; Seconds,"['equipment: dumbbells', 'basic_functional_movement: squat']",strength 1; soflete rx'd; soflete performance; soflete fitness; stamina 1; strength; specialty work; stamina; stamina 3,1,1,0,2,741,58b77e78af8fd7000fab46be,Weight (Actual),
,Dumbbell Hex Press,,,,,,,,,,,,,,,,dumbbells,,,['equipment: dumbbells'],,0,0,0,0,293,57e2fd3a4c6a031dc777e95a,#N/A,
,Dumbbell Hip Thrust,,,,,,strength_integrated_resistance,,,,,,,,,https://youtu.be/mFRKGqC-LoA,dumbbells,,Reps,['equipment: dumbbells'],accessory work; strength 1; sky's out thighs out; skyâ€™s out thighs out (accessory work); stamina 1,1,1,0,2,1638,5c55e2b37732f500103c7336,Weight (Actual),
,Dumbbell Lateral Raise,,,,,,,,,,,,,,,https://youtu.be/3VcKaXpzqRo,dumbbells,,Reps,"['equipment: dumbbells', 'movement direction - plane: frontal', 'movement direction - axis: lateral']",accessory work 2; accessory work; suns out guns out 1; strength 6; strength 5; accessory work 4; accessory work 1,1,0,0,1,1741,5c9cf1f8cc3ad8000f18e13f,Weight (Actual),
,Dumbbell Overhead Carry,,,,,,strength_integrated_resistance,walk,,,,,,,,https://www.youtube.com/watch?v=p6HKV1_6P20,dumbbells,,Reps; Meters; Feet; Seconds,"['basic_exercise: carry', 'equipment: dumbbells']",accessory work 2; accessory work; warm-up/movement prep; strength 1; strength 3; trunk work 2; weapons development; strength 2; trunk work; trunk 2; stamina 1; gymnastics; strength; trunk work 1; stamina,1,1,0,2,699,589c96d72f2824000f430bae,Weight (Actual),
,Dumbbell Pinch Carry,"holding the end of a dumbell in each hand, carry",,,,,strength_integrated_resistance,walk,,,,,,,,https://youtu.be/zxr7pejGSMg,dumbbells,,Meters; Feet,"['basic_exercise: carry', 'equipment: dumbbells']",accessory work; strength 1; stamina; strength,1,1,0,2,1890,5d13eabdfce11500125ac0b7,Weight (Actual),
,Dumbbell Powell Raise,,,,,,,,,,,,,,,https://www.youtube.com/watch?v=PCuECDxWCFU,dumbbells,,Reps,['equipment: dumbbells'],accessory work 2; accessory work; strength 2; strength; accessory work 1,1,0,0,1,1685,5c6a275d452189000f35d273,Weight (Actual),
,Dumbbell Power Clean,,,,,,strength_integrated_resistance,,,,,,,,,https://www.youtube.com/watch?v=b90Njh_33gE,dumbbells,,Reps,"['olympic_lift: power clean', 'equipment: dumbbells']",conditioning; stamina 3; soflete rx'd; strength 3; soflete performance; mixed modal 1; conditioning 2; strength 2; soflete fitness; stamina 1; strength; stamina; stamina 2,1,1,0,2,1004,59cee0ea4e790f000f8fbc41,Weight (Actual),
,Dumbbell Pullover,,,,,,,,,,,,,,,https://www.youtube.com/watch?v=tpLnfSQJ0gg,dumbbells,,Reps,['equipment: dumbbells'],accessory work 1; strength 2,1,0,0,1,1197,5ab920b1b678c5000fde4135,Weight (Actual),
