,Seated Press Down,,,,,,,,,,,,,,,https://youtu.be/ZUVotnI8PgQ,,seated,,[],,0,0,0,0,992,59cc5628546031000fe95cdf,#N/A,
,Seated Rotator Cuff Rotation,,,,,,,,,,,,,,,https://youtu.be/14UILfWZ1Kg,,seated,,"['movement direction - plane: transverse', 'movement direction - axis: rotational']",,0,0,0,0,964,59c9b8563d98d0000fd805b9,#N/A,
,Seated See Saw Dumbbell Press,,,,,,strength_integrated_resistance,,,,,,,,,https://youtu.be/5ZA1ZByCEl8,dumbbells,,Reps,['equipment: dumbbells'],warm-up/movement prep; gymnastics; strength 1,1,0,0,1,1469,5bec3a6d438d7d000f6134dc,Weight (Actual),
,Seated Side Straddle Stretch,,,,,,flexibility,,,,,,,,,https://www.youtube.com/watch?v=9AqIdswd11A,,,Reps; Minutes; Seconds,[],mobility; mobility (long); warm-up; movement work; recovery protocol; recovery work; recovery day; pigeon pose,0,0,0,0,803,590c750b785873000f048188,#N/A,
,Seated Single Arm Arnold Press,,,,,,strength_integrated_resistance,,,,,,,,,https://www.youtube.com/watch?v=3Lhln4TspkU,,,Reps,[],warm-up/movement prep; accessory work; strength 1; strength 3; suns out guns out 1; warm-up; strength 4; strength 2; strength; movement primer,1,0,0,1,928,5999c153fd7558000f828944,Weight (Actual),
,Seated Single Arm Cable Row,,,,,,strength_integrated_resistance,,,,,,,,,https://youtu.be/CrylzZHfO1c?t=50,,,Reps,"['equipment: rower', 'equipment: cables']",strength 4,1,0,0,1,1815,5ce34da1cc3ad8000f29a0d1,Weight (Actual),
,Seated Single Arm DB Press,,,,,,strength_integrated_resistance,,,,,,,,,https://www.youtube.com/watch?v=tF2D6Imrb_s,dumbbells,,Reps,['equipment: dumbbells'],strength work; accessory work; strength 1; strength 2; strength,1,0,0,1,792,59028398825920000fab7dca,Weight (Actual),
,Seated Single Arm KB Press w/ Rack Hold,,,,,,strength_integrated_resistance,,,,,,,,,https://www.youtube.com/watch?v=nl-2livrVAc,kettlebells,,Reps,['equipment: kettlebells'],strength 1; movement primer,1,0,0,1,1219,5ac3dce6d4365e000f267664,Weight (Actual),
,Seated Single Arm Low Band Row,,,,,,,,,,,,,,,https://youtu.be/kj-0S8crpag,,seated,Reps,['equipment: rower'],warm-up/movement prep; accessory work,0,0,0,0,1849,5d01134dfce11500125678d3,#N/A,
,Seated Single Leg Box Jump,,,,,,power_action_plyometrics,,,,,,,,,https://www.youtube.com/watch?v=PrbCcRc9814,,,Reps; Time,"['basic_exercise: box jumps', 'body position: single leg standing', 'basic_functional_movement: jump']",accessory work; strength; plyometrics,1,0,1,2,1144,5a73bb5f498b15000f99b806,Weight (Actual),
,Seated Single Leg Lift,,,,,,,,,,,,,,,https://www.youtube.com/watch?v=xYjfOf5151M,,seated,Reps,['body position: single leg standing'],warm-up/movement prep; warm-up / movement prep,0,0,0,0,931,59a03d7e332cef000f6d8e40,#N/A,
,Seated Sled Face Pull,,,,,,,,,,,,,,,https://www.youtube.com/watch?v=Bv3QmFte8RY,,seated,Meters,['equipment: sled'],accessory work; strength 1,1,0,0,1,1263,5ae08dc91a4308000fc578ad,Weight (Actual),
,Seated Sled Pull,,,,,,,,,,,,,,,https://youtu.be/CrXhOS8eSGw,,seated,Meters; Feet,['equipment: sled'],strength 1; strength 3; strength 2; strength; stamina; strongman,1,1,0,2,709,58a1d99bc892b2000f49976e,Weight (Actual),
,Seated Straddle,,,,,,,,,,,,,,,,,seated,Reps,[],accessory work; suns out guns out,0,0,0,0,137,57e2fd3a4c6a031dc777e8b0,Weight (Actual),
,Seated Straddle DB Press,,,,,,strength_integrated_resistance,,,,,,,,,https://youtu.be/LGySoBtUxJ0?list=PL4T3VJwPWwuFotqGyAGlfoYdkoTQzbrZe,dumbbells,,Reps,['equipment: dumbbells'],accessory work 2; accessory work; strength 1; strength,1,0,0,1,595,586fee00b06dc50011d08119,Weight (Actual),
,Seated Straddle Stretch,,,,,,flexibility,,,,,,,,,https://www.youtube.com/watch?v=6LufNrZwZWg,,,Minutes; Time,[],recovery; mobility; recovery portocol; recovery protocol; recovery work; recovery protocol (long),0,0,0,0,829,5931a08395e3f3000f93dcfd,#N/A,
,Seated Sumo Stance Good Mornings,,,,,,,,,,,,,,,https://youtu.be/IrcKuJQ4Fww,,seated,Reps,[],strength 3,1,0,0,1,1488,5bec3c7ccb07e9000fc95ddb,Weight (Actual),
,Seated Supinated Grip Overhead Press,,,,,,strength_integrated_resistance,,,,,,,,,https://youtu.be/odDHdIBhEKg,,,Reps,['body position: supine'],strength 4,1,0,0,1,1834,5ceccbf8cc3ad8000f2b9d5a,Weight (Actual),
,Seated Thoricac Spinal CARs,,,,,,,,,,,,,,,https://www.youtube.com/watch?v=TjM87lCS-04,,seated,Reps,[],recovery protocol,0,0,0,0,1425,5bc65a322a30b5000fd3207d,#N/A,
,Seated Vertical Jump,,,,,,power_action_plyometrics,,,,,,,,,https://youtube.com/watch?v=XKFTR6T-gBE,,,Reps,"['basic_exercise: vertical jumps', 'movement direction - axis: vertical', 'basic_functional_movement: jump']",plyometrics; power work,0,0,1,1,712,58a5bc13874b20000f52dfbf,Weight (Actual),
,Seated Zercher Good Morning,,,,,,,,,,,,,,,https://www.youtube.com/watch?v=tr8ZFfXDInM,,seated,Reps,[],accessory work,0,0,0,0,1027,59f092b9145143000f727c89,Weight (Actual),
,See Saw Bent Over Row,,,,,,strength_integrated_resistance,,,,,,,,,https://www.youtube.com/watch?v=Vn21SBrAuVc,,,Reps,['equipment: rower'],accessory work; strength 2,1,0,0,1,1653,5c5e4b436c2e26000f13fa8e,Weight (Actual),
,See Saw Dumbbell Row,,,,,,strength_integrated_resistance,,,,,,,,,https://youtu.be/Vn21SBrAuVc,dumbbells,,Reps,"['equipment: dumbbells', 'equipment: rower']",accessory work; accessory work 1; strength 1; strength 2,1,0,0,1,1406,5ba9d87e6ec511000f3a8940,Weight (Actual),
,See Saw Walk to Burpee,,,,,,power_action_plyometrics,,,,,,,,,,,,,['basic_functional_movement: step'],,0,0,0,0,402,57e2fd3b4c6a031dc777e9cb,#N/A,
,See Saw Walk to Vertical Jump,,,,,,power_action_plyometrics,,,,,,,,,,,,,"['basic_exercise: vertical jumps', 'movement direction - axis: vertical', 'basic_functional_movement: step', 'basic_functional_movement: jump']",,0,0,0,0,403,57e2fd3b4c6a031dc777e9cc,#N/A,
,Seesaw Plank,,,,,,strength_endurance,,,,,,,,,https://youtu.be/Km_G3K9in-k,,,Reps; Minutes; Seconds,['basic_functional_movement: stabilizer'],warm-up/movement prep; accessory work 2; accessory work; stamina 1; warm-up / movement prep,0,1,0,1,1620,5c4963620810e6000f246def,#N/A,
,Seize Sit,,,,,,flexibility,,,,,,,,,https://youtu.be/aPywyOQdg3U,,,Reps; Minutes,[],recovery protocol,0,0,0,0,1711,5c7702b731c07b000f579d17,#N/A,
,Semi Supinated DB Bench Press,,,,,,strength_integrated_resistance,,,,,,,,,https://www.youtube.com/watch?v=38qwyV0YlRg,dumbbells,,Reps,"['basic_exercise: bench press', 'equipment: dumbbells', 'body position: supine']",accessory work; strength 2,1,0,0,1,1188,5ab0502c16557e000f3b2401,Weight (Actual),
,Serratus Wall Slides,,,,,,,,,,,,,,,https://youtu.be/EugElNVC2BU,,,Reps,[],mobility work; movement flow,0,0,0,0,1073,5a18954b4e7ddd000fd5283e,#N/A,
,Shark Drill,based on freestyle,,300,,,strength_cardiorespiratory,swim,,,stable,,,none,,https://youtu.be/4w-_vc0I-wk?t=14,,,Yards,[],stroke refinement; stroke skill 1; stroke skill - technical focus,0,0,0,0,1574,5c1d36c69eb3da000f11e1b7,#N/A,
,Shin Box Get Up,,,,,,,,,,,,,,,https://youtu.be/IW81FCuBwbA,,,Seconds,[],recovery protocol,0,0,0,0,1643,5c586a92f9f7a8000f778ce7,#N/A,
,Shin Box Landmine Hip Fold to Extension,,,,,,,,,,,,,,,https://youtu.be/NKBIPQu6-aw,,,Reps,['movement direction - plane: sagittal'],warm-up/movement prep,0,0,0,0,1627,5c4f3f4407910b000fd3542a,Weight (Actual),
,Shin Hop to Broad Jump,,,,,,power_action_plyometrics,,,,,,,,,https://www.youtube.com/watch?v=MHfKe6jSCBo,,,Reps,"['basic_exercise: broad jumps', 'basic_functional_movement: jump']",strength 1; plyometrics,1,0,1,2,404,57e2fd3b4c6a031dc777e9ce,#N/A,
,Shin Hop to Tuck Jump,,,,,,power_action_plyometrics,,,,,,,,,,,,,['basic_functional_movement: jump'],,0,0,0,0,405,57e2fd3b4c6a031dc777e9cf,#N/A,
,Shin Hops,,,,,,,,,,,,,,,,,,,['basic_functional_movement: jump'],,0,0,0,0,406,57e2fd3b4c6a031dc777e9d0,#N/A,
,Shin Hops to Box Jump,,,,,,power_action_plyometrics,,,,,,,,,https://youtube.com/watch?v=xkjBe7gNQU8,,,Reps,"['basic_exercise: box jumps', 'basic_functional_movement: jump']",assistance work; plometrics; strength 2; plyometrics,1,0,1,2,742,58b8942dc7cfd3000f0bee8e,#N/A,
,Shinbox Get-Up,,,,,,,,,,,,,,,,,,Reps,[],warm up/movement prep,0,0,0,0,464,57e9428fea207e10001ee5af,#N/A,
,Shinhop to Box Jump,,,,,,power_action_plyometrics,,,,,,,,,https://www.youtube.com/watch?v=raWzuabF6kU,,,Reps,"['basic_exercise: box jumps', 'basic_functional_movement: jump']",strength 1; plyometrics,1,0,1,2,836,5936cd5e95e3f3000f945a0e,Weight (Actual),
,Shoelace Pose,,,,,,,,,,,,,,,https://youtube.com/watch?v=ptxLXNQV2bI,,,Minutes; Time,[],recovery protocol; mobility (ps/te); mobility (internal bs); mobility,0,0,0,0,132,57e2fd3a4c6a031dc777e8aa,#N/A,
,Shooting - 3x5 Warm-up,,,,,,skill_development,,,,,,,,,https://youtu.be/nj1TV4EYyJk,,,Reps,[],pistol - concealed carry (cc) - 3x5 warm-up; pistol - concealed carry (cc); pistol - outside the waistband; pistol - concealed carry; wet work: pistol - concealed carry,0,0,0,0,827,592b1b962cd726000f61f596,#N/A,
,Shooting - 5x5 Warm-up,,,,,,skill_development,,,,,,,,,https://youtu.be/tj7QUprhrpQ,,,Reps,[],wet work: pistol - outside the waistband; pistol - outside the waistband; pistol - outside the waistband (owb) - 5x5 warm-up; pistol - outside the waistband (owb),0,0,0,0,826,592b1b2c2cd726000f61f583,#N/A,
,Short Skips,,,,,,,,,,,,,,,,,,,[],,0,0,0,0,407,57e2fd3b4c6a031dc777e9d1,#N/A,
,Shoulder and T-Spine Flow,,,,,,,,,,,,,,,https://youtu.be/hvG05WP4rKk,,,Minutes,[],movement flow; mobility; breathing work; recovery protocol; breathing/movement,0,0,0,0,1124,5a5aca5b425068000fee547e,#N/A,
,Shoulder CAR,,,,,,,,,,,,,,,https://youtu.be/HiCnRk1_z5Q,,,Reps; Minutes,[],endurance prep; breathing work; down regulation breathing; recovery protocol; breathing / movement; breathing / movement work; endurance,0,0,0,0,1276,5af7d3691a4308000fc868b1,#N/A,
,"Shoulder Extension, External Rotation",,,,,,,,,,,,,,,https://youtu.be/y8WKcz0vqzg,,,Minutes; Time,"['movement direction - plane: sagittal', 'movement direction - plane: transverse', 'movement direction - axis: rotational']",prehab/dynamic warm up; mobility; mobility (internal bs); recovery protocol; mobility (bow pose),0,0,0,0,476,58268782473c06100052eded,#N/A,
,Shoulder Flexion Against Wall,,,,,,,,,,,,,,,https://youtu.be/PvaBOAALZzI?list=PL4T3VJwPWwuFotqGyAGlfoYdkoTQzbrZe,,,Reps,['movement direction - plane: sagittal'],warm-up/movement prep; movement prep; prehab/dynamic warm-up; prehab / dynamic warm-up; prehab/dynamic warm up; prehab / dynamic warm-up (pillar wo.); prehab/dynamic warm-up - 3; recovery protocol; prehab/dynamic warm-up (shoulder press); correctives,0,0,0,0,473,5823904a473c06100052edac,#N/A,
,Shoulder Internal Rotation,,,,,,,,,,,,,,,,,,,"['movement direction - plane: transverse', 'movement direction - axis: rotational']",,0,0,0,0,175,57e2fd3a4c6a031dc777e8d8,#N/A,
,Shoulder Mobility w/LAX Ball,,,,,,,,,,,,,,,https://youtu.be/wyh3W3wXxCU,,,Seconds; Minutes,[],mobility (prayer); mobilitiy; mobility; recovery protocol; stamina,0,1,0,1,487,582b5aef473c06100052ee85,#N/A,
,Shoulder Ring Flow,,,,,,,,,,,,,,,https://youtu.be/8NYiC8mG-Us,,,,[],,0,0,0,0,1175,5aa2eb25b678c5000fdbbb96,#N/A,
,Shoulder Rotations,,,,,,,,,,,,,,,https://youtu.be/bE2z9rvCl5c,,,Reps,[],movement flow; accessory work; cars warm-up; warm-up; mobility work; skill development,0,0,0,0,993,59cc564c546031000fe95ce0,Weight (Actual),
,Shoulder to Overhead,,,,,,,,,,,,,,,https://www.youtube.com/watch?v=N3wdSFarZ_0,,,Reps; Time,[],conditioning; stamina 3; strength 1; soflete rx'd; soflete performance; stamina 4; conditioning option b; conditioning 3; soflete fitness; stamina 1; gymnastics; conditioning 1; bonus work; stamina; stamina 2,1,1,0,2,485,582b53e2473c06100052ee6a,Weight (Actual),
,Shoulder to Shoulder Sandbag Thruster,,,,,,power_action_plyometrics,,,,,sandbags,,,,https://youtu.be/8IemfQ2eQ6Y,sandbags,,Reps,['equipment: sandbags'],stamina,0,1,0,1,1861,5d052a05cc3ad8000f314338,Weight (Actual),
,Shovel Deadlift,,,,,,strength_integrated_resistance,,,,,,,,,https://www.youtube.com/watch?v=_q_ZWql5XhU,barbells,,Reps,['olympic_lift: deadlift'],accessory work; stength 2; strength 1; skys out thighs out 1; strength 2; skys out thighs out; strength; stamina,1,1,0,2,785,59012420d3a431000f793806,Weight (Actual),
,Shrug and Shift,,,,,,,,,,,,,,,https://youtu.be/UVy1tW7BbVk,,,Reps,[],warm-up/movement prep; prehab/dynamic warm up; prehab/dynamic warm-up,0,0,0,0,682,588a5b68ba4bcd000fd7af74,#N/A,
,Shrugs,,,,,,,,,,,,,,,,,,,[],,0,0,0,0,60,57e2fd3a4c6a031dc777e85a,#N/A,
,Shuttle Run,,,,,,power_drills_plyometrics,,,,stable,,,,,,,,Reps; Time; Yards; Meters,"['equipment: running', 'basic_functional_movement: run']",conditioning; stamina 3; accessory stamina; warm-up/movement prep; strength & stamina; heart rate elevation; stamina 1; strength; specialty work; stamina; stamina 2,1,1,0,2,684,588b625cba4bcd000fd7b175,#N/A,
,Shuttle Sprint,,,,,,power_drills_plyometrics,,,,stable,,,,,https://youtube.com/watch?v=MuJ9vVIBCdE,,,Seconds; Meters; Minutes; Feet; Yards; Reps; Time,['basic_functional_movement: sprint'],stamina 3; carbine; accessory stamina; accessory work; warm-up/movement prep; speed runs; heart rate elevation; stamina 1; pistol - outside the waistband; pistol - concealed carry; strength; warm-up / movement prep; stamina; stamina 2,1,1,0,2,499,583c867ffbefd210001e345e,#N/A,
,Shuttle Sprints,,,,,,power_drills_plyometrics,,,,stable,,,,,https://youtu.be/zpOv1yjIlX4?t=33,,,Meters,['basic_functional_movement: sprint'],stamina 1,0,1,0,1,1637,5c530d892fd9e8000f39d8ea,#N/A,
,Side Balance Leg Raise,,,,,,,,,,,,,,,https://youtu.be/k9it4aiIMm0,,,Seconds,[],strength 2,1,0,0,1,1520,5bfa52cd011489000ff312bc,#N/A,
,Side Bend Stretch,,,,,,flexibility,,,,,,,,,https://youtu.be/iZtitl9jemM,,,Seconds; Reps; Minutes,[],recovery; accessory work; mobility; recovery protocol; moblity,0,0,0,0,136,57e2fd3a4c6a031dc777e8af,#N/A,
,Side Bridge,,,,,,strength_endurance,,,,,,,,,https://youtu.be/VWWR-y3-yUc,,bridge,Reps; Seconds,[],accessory work 2; accessory work; accessory work 4,0,0,0,0,1911,5d2ec16fcc3ad8000f3ac6ce,#N/A,
,Side Kick Only (Kick Board),,,,,,,,,,,,,,,https://youtu.be/JaydLwK6VBU?t=1,,,,[],,0,0,0,0,1573,5c1d36939eb3da000f11e19f,#N/A,
,Side Lying Banded Clamshell,,,,,,strength_integrated_resistance,,,,,,,,,https://youtu.be/qNjh-nePA0s,resistence_bands,,Reps; Seconds,['body position: side lying'],warm-up/movement prep; accessory work; run warm-up; skill prep; warm-up; accessory work 3; strength 2; warm-up / movement prep,1,0,0,1,1511,5bf21e18a566b3000fcefb83,#N/A,
,Side Lying Clam Bridge,DUPLICATE,,,,,strength_endurance,,,,,,,,,https://youtu.be/lX66g20bZXQ?t=82,,side_lying,Reps; Seconds,['body position: side lying'],accessory work 2; accessory work; strength 1; strength 3; strength 2; core,1,0,0,1,1541,5c0ec3404f9813000fe4f93f,Weight (Actual),
,Side Lying Clam Bridges,DUPLICATE,,,,,strength_endurance,,,,,,,,,https://www.youtube.com/watch?v=Mbc1LKm41RA,,side_lying,Reps,['body position: side lying'],accessory work 2; accessory work; strength 2,1,0,0,1,1678,5c67648413b7570012250e61,#N/A,
,SIDE LYING CLAMSHELLS,DUPLICATE,,,,,strength_endurance,,,,,,,,,https://youtu.be/zhHKqKKXAnM,,side_lying,Reps; Time; Seconds,['body position: side lying'],strength 1; warm-up /movement prep; mobility; sports specific day warm-up; run development; sports specific warm-up; mobility work; warm-up/movement prep; strength work; movement prep; bike skill development; sports specific day warm up; warm up/movement prep; ssp day warm-up; accessory work; endurance prep; brick session; run development day; warm-up; accessory work 3; strength 2; warm-up / movement prep; skill development,1,0,0,1,539,58541c9b988c130011bbc42f,#N/A,
,Side Lying DB External Rotation,,,,,,strength_integrated_resistance,,,,,,,,,https://youtu.be/_1VicYVDnyM,dumbbells,side_lying,Reps,"['equipment: dumbbells', 'body position: side lying', 'movement direction - plane: transverse', 'movement direction - axis: rotational']",accessory work 1,0,0,0,0,1326,5b5b82281b4ba1000f5d1fbf,Weight (Actual),
,Side Lying Hip Circles,,,,,,strength_endurance,,,,,,,,,https://youtu.be/E58q53xVn8g,,side_lying,Reps,['body position: side lying'],warm-up/movement prep,0,0,0,0,1951,5d64d39a3980560012fe335d,#N/A,
,Side Lying T-Spine Rotation,,,,,,flexibility,,,,,,,,,https://youtu.be/twGnMnUapAs,,side_lying,Reps; Minutes,"['body position: side lying', 'movement direction - plane: transverse', 'movement direction - axis: rotational']",warm-up/movement prep; warm-up/ movement prep; strength 2; recovery protocol; warm-up / movement prep,1,0,0,1,1744,5c9d036b60e5d3000f11f53c,#N/A,
,Side Lying T-Spine Rotations,,,,,,flexibility,,,,,,,,,https://www.youtube.com/watch?v=ib7OgvnpgeI,,side_lying,Reps; Minutes,['body position: side lying'],warm-up/movement prep; movement flow; skill prep; breathing work; warm-up; recovery protocol; mobility work; warm up/movement prep; accessory work 1,0,0,0,0,1658,5c5fb81082c07a00126c9a8a,#N/A,
,Side Pillar Hold Hip Drop and Reach,,,,,,,,,,,,,,,https://www.youtube.com/watch?v=f_iVr4EzhwA,,,,[],,0,0,0,0,241,57e2fd3a4c6a031dc777e924,#N/A,
,Side Pillar with Hip Drop-Reach,,,,,,,,,,,,,,,,,,,[],,0,0,0,0,409,57e2fd3b4c6a031dc777e9d3,#N/A,
,Side Pillar with Hip Reach,,,,,,,,,,,,,,,,,,,[],,0,0,0,0,410,57e2fd3b4c6a031dc777e9d4,#N/A,
,Side Plank,,,,,,strength_endurance,,,,,,,,,https://youtu.be/N_6ArXP_Omk?list=PL4T3VJwPWwuFotqGyAGlfoYdkoTQzbrZe,,,Seconds; Reps; Minutes; Time,['basic_functional_movement: stabilizer'],callisthenics; strength 1; recovery protocol; assisted work; neuro adaptation; core; warm-up/movement prep; strength work; accessory work 2; strength 6; bonus material; stamina 1; strength; bonus work (optional); warm up/movement prep; stamina; calisthenics; accessory work; recovery; trunk work 2; accessory work 4; correctives; movement flow; warm-up; accessory work 3; strength 2; warm-up / movement prep,1,1,0,2,102,57e2fd3a4c6a031dc777e88a,Weight (Actual),
,Side Plank Adductor Raise,,,,,,strength_endurance,,,,,,,,,https://youtu.be/nM2Kk_wDSLI?list=PL4T3VJwPWwuFotqGyAGlfoYdkoTQzbrZe,,,Reps; Minutes; Time; Seconds,"['movement direction - plane: frontal', 'basic_functional_movement: stabilizer']",warm-up/movement prep; accessory work; accessory work 2; prehab/dynamic warm-up; prehab/dynamic warm up; prehab / dynamic warm-up; accessory work 3; prehab/dynamic warm up (jog 05:00); prehab/dynamic warm-up - 3; prehab/dynamic warm-up (shoulder press); neuro adaptation,0,0,0,0,471,58238ef3473c06100052edaa,Weight (Actual),
,Side Plank Clamshell,,,,,,strength_endurance,,,,,,,,,https://www.youtube.com/watch?v=a0pu5eYghs4,,,Reps; Time,['basic_functional_movement: stabilizer'],warm-up/movement prep; strength 1; warm-up; warm up/movement prep; warm-up / movement prep; stamina,1,1,0,2,1244,5ad8a8f0b678c5000fe2f6ad,#N/A,
,Side Plank on Rings,,,,,,strength_endurance,,,,,,,,,https://www.youtube.com/watch?v=N8iFVEcInsA,,,Seconds; Reps; Time,['basic_functional_movement: stabilizer'],accessory work; strength 1; bonus material; strength 5; strength,1,0,0,1,948,59c30ce33d98d0000fd7631f,#N/A,
,Side Plank Rotation,,,,,,strength_endurance,,,,,,,,,https://www.youtube.com/watch?v=Qo0j8L8sXJk,,,Seconds; Reps; Minutes; Time,"['movement direction - plane: transverse', 'movement direction - axis: rotational', 'basic_functional_movement: stabilizer']",warm-up/movement prep; accessory work; movement flow; accessory work 2; strength 1; warm-up; strength 2; warm up/movement prep; warm-up / movement prep; core,1,0,0,1,1287,5b02f8183eac7a000f727287,Weight (Actual),
,Side Plank with Shoulder Rotation,,,,,,strength_endurance,,,,,,,,,https://youtu.be/LOnsBk0bhfw,,,Reps,"['movement direction - plane: transverse', 'movement direction - axis: rotational', 'basic_functional_movement: stabilizer']",warm-up/movement prep; core,0,0,0,0,1773,5cb09dfdfce115001243f815,#N/A,
,Side Shuffle with Arm Swings,,,,,,,,,,,,,,,https://youtu.be/7gXvzuIzeCE,,,,[],,0,0,0,0,1559,5c1d30704f9813000fe81d0c,#N/A,
,Side Star Plank,,,,,,strength_endurance,,,,,,,,,https://youtu.be/5oB44pBFIVE,,,Seconds; Minutes; Time,['basic_functional_movement: stabilizer'],warm-up/movement prep; accessory work; accessory work 2; strength 1; strength 3; weapons development; warm-up; strength 4; strength 6; strength 2; bonus material; stamina; strength; accessory work 4; warm-up / movement prep; assistance work; core,1,1,0,2,843,594bff062f01a7000f72a2e5,#N/A,
,Side Straddle Hops,,,,,,,,,,,,,,,,,,,['basic_functional_movement: jump'],,0,0,0,0,183,57e2fd3a4c6a031dc777e8e0,#N/A,
,Side to Side Hanging Leg Raises,,,,,,,,,,,,,,,https://www.youtube.com/watch?v=h0xm9hBIwNI,,,Reps,[],accessory work,0,0,0,0,1669,5c5fbfe782c07a00126c9ba0,#N/A,
,Side to Side on Pull-Up Bar,,,,,,strength_integrated_resistance,,,,,,,,,https://youtu.be/MZS0AywPFNg,,,Reps,['basic_exercise: pull-ups'],weapons development,0,0,0,0,1204,5aba751db678c5000fde709b,#N/A,
,Side-lying Internal Dumbbell Rotation,,,,,,strength_integrated_resistance,,,,,,,,,,dumbbells,side_lying,,"['equipment: dumbbells', 'body position: side lying', 'movement direction - plane: transverse', 'movement direction - axis: rotational']",,0,0,0,0,78,57e2fd3a4c6a031dc777e86e,#N/A,
,Sidelying Banded Leg Lift,,,,,,strength_integrated_resistance,,,,,,,,,https://youtu.be/KB5OQMPByow,resistence_bands,,Reps,['body position: side lying'],accessory work,0,0,0,0,1477,5bec3929928046000fa52014,#N/A,
,Sidelying Trunk Rotation with Rib Pull,,,,,,,,,,,,,,,https://youtu.be/x6Wdl-RmObM?list=PL4T3VJwPWwuEnPSfKLKNVPGX02-ybszb3,,,Reps,"['body position: side lying', 'movement direction - plane: transverse', 'movement direction - axis: rotational']",warm-up/movement prep; warm up/movement prep,0,0,0,0,155,57e2fd3a4c6a031dc777e8c3,#N/A,
,Single Arm Band Curl,,,,,,,,,,,,,,,https://youtu.be/8ZxYAAXhmAM,,,Reps,[],accessory work; strength 5,1,0,0,1,1789,5cb8e00cfce1150012460a06,#N/A,
,Single Arm Banded Cuban Press,,,,,,strength_integrated_resistance,,,,,,,,,https://youtu.be/I1PruAi6lac,resistence_bands,,Reps,[],accessory work 1; strength 5; strength 4,1,0,0,1,1787,5cb825b8fce115001245d3d4,#N/A,
,Single Arm Banded Tricep Pushdown,,,,,,strength_integrated_resistance,,,,,,,,,https://youtu.be/Zgz6JSE_0Tg,resistence_bands,,Reps,[],accessory work; strength 5,1,0,0,1,1692,5c6ca4ef452189000f369c44,Weight (Actual),
,Single Arm Bent Over Dumbbell Lateral Raises,,,,,,strength_integrated_resistance,,,,,,,,,https://youtu.be/iUQNO3sgrnA,dumbbells,,Reps,"['equipment: dumbbells', 'movement direction - plane: frontal', 'movement direction - axis: lateral']",accessory work; strength 1; strength 2; bonus material,1,0,0,1,1463,5bec39c2438d7d000f6134a9,Weight (Actual),
,Single Arm Cable Lat Sweeps,,,,,,,,,,,,,,,https://youtu.be/1uvIJZ4X7eQ,,,Reps,['equipment: cables'],accessory work; strength 4,1,0,0,1,1464,5bec39d6cb07e9000fc95d0d,Weight (Actual),
,Single Arm Crossbody Dumbbell Deadlift,,,,,,strength_integrated_resistance,,,,,,,,,https://www.youtube.com/watch?v=lQEjT0ezT0g,dumbbells,,Reps,"['olympic_lift: deadlift', 'equipment: dumbbells']",warm-up/movement prep; warm-up/movement work; stamina; warm-up / movement prep,0,1,0,1,1879,5d106c5860e5d3000f2c83de,Weight (Actual),
,Single Arm DB Front Squat,,,,,,strength_integrated_resistance,,,,,,,,,https://youtu.be/69vGmvKO7X4,dumbbells,,,"['equipment: dumbbells', 'basic_functional_movement: squat']",,0,0,0,0,1695,5c6e4d6b452189000f370683,#N/A,
,Single Arm DB Muscle Snatch,,,,,,strength_integrated_resistance,,,,,,,,,https://www.youtube.com/watch?v=oM0BG1SxyCg,dumbbells,,Reps,"['olympic_lift: snatch', 'equipment: dumbbells']",warm-up/movement prep; warm-up / movement prep,0,0,0,0,1279,5af9b3e41d38c4000febee89,Weight (Actual),
,Single Arm DB Power Clean,,,,,,strength_integrated_resistance,,,,,,,,,https://www.youtube.com/watch?v=Rtyz8IDOcqs,dumbbells,,Reps,"['olympic_lift: power clean', 'equipment: dumbbells']",warm-up / movement prep; stamina; strength 3,1,1,0,2,1648,5c5cfd9e6c2e26000f13a411,Weight (Actual),
,Single Arm DB Press,,,,,,,,,,,,,,,https://www.youtube.com/watch?v=gC79JHUadz4,dumbbells,,,['equipment: dumbbells'],,0,0,0,0,1654,5c5e4dac82c07a00126c5349,#N/A,
,Single Arm DB/KB Thruster,,,,,,power_action_plyometrics,,,,,kettlebells,,,,https://www.youtube.com/watch?v=BCbUZxbBpn4,kettlebells,,Reps,"['equipment: dumbbells', 'equipment: kettlebells']",warm-up/movement prep; carbine; accessory work; strength 1; open 18.5 prep; warm-up; mix modal; strength 2; pistol - outside the waistband; pistol - concealed carry; stamina 1; strength; warm up/movement prep; warm-up / movement prep; stamina; movement primer; stamina 2,1,1,0,2,414,57e2fd3b4c6a031dc777e9d8,Weight (Actual),
,Single Arm Drill (Combat Side Stroke),,,300,,,strength_cardiorespiratory,swim,,,stable,,,none,,https://youtu.be/iwCYK5KxSmA?t=6,,,Yards,[],warm-up/movement prep; stroke refinement; stamina; stroke skill 2,0,1,0,1,1579,5c1d37a92fa17a000f553383,#N/A,
,Single Arm Drill (Freestyle),,,300,,,strength_cardiorespiratory,swim,,,stable,,,none,,https://youtu.be/OpTqAuX-pEI?t=3,,,Yards,[],stoke skill 2; stroke skill 2,0,0,0,0,1578,5c1d37812fa17a000f55337d,#N/A,
,Single Arm Dumbbell Bench Press,,,,,,strength_integrated_resistance,,,,,,,,,https://www.youtube.com/watch?v=TVM2S2KWX6Q,dumbbells,,Reps,"['basic_exercise: bench press', 'equipment: dumbbells']",accessory work 2; accessory work; suns out guns out; strength 1; strength 3; strength 2; trunk work; stamina 1; strength; neuro adaptation; mobility work; accessory work 1,1,1,0,2,411,57e2fd3b4c6a031dc777e9d5,Weight (Actual),
,Single Arm Dumbbell Clean,,,,,,strength_integrated_resistance,,,,,,,,,https://youtu.be/RF8iX5jl2Ng?list=PL4T3VJwPWwuEnPSfKLKNVPGX02-ybszb3,dumbbells,,Reps,['equipment: dumbbells'],stamina; strength,1,1,0,2,22,57e2fd3a4c6a031dc777e833,Weight (Actual),
,Single Arm Dumbbell Complex - Power Snatch to Thruster,,,,,,strength_integrated_resistance,,,,,,,,,,dumbbells,,,"['olympic_lift: snatch', 'equipment: dumbbells']",,0,0,0,0,412,57e2fd3b4c6a031dc777e9d6,#N/A,
